{"artifact_hash":"e856dedf1879135eea547ac00d7e6243621dd6ff5c59164c6697131e22e46eb4","artifact_uri":"docs/evaluation/pitchapi-v3-models/pitchapi-v3-reference-artifact.json","calibrator_refs":[],"contract":"ModelRegistration","dependency_fingerprint":"d14def6539f213b2af3011975062ed3e1e0bba2d86e8064803bd3d86d0a39e4e","eligible_competitions":null,"eligible_products":["SCORE_DISTRIBUTION"],"evaluation_refs":["docs/evidence/pitchapi-domain-stratified-v3-terminal-failure-2026-09-26.json"],"family":"MATCHFORGE_TRANSFERABLE_POISSON","feature_contract":"MATCHFORGE_TRANSFERABLE_ROLLING_LAST10_V1","implementation_version":"transferable-rolling-goals-poisson-v1-analytic-adapter-v2","lifecycle_state":"CHAMPION","model_id":"transferable-rolling-goals-poisson-v1","training_cutoff":"2022-05-14T13:35:00+00:00","training_manifest":"be4251a4f53307bae0895c856b5a9ffdf21cdd64da9f0610c8273924d4bef62e","training_start":"2021-08-13T18:30:00+00:00","version":"transferable-rolling-goals-poisson-v1"}
